ticker,friendlyName,registrantName,seriesName,className,expenseRatio,fiscalYearEnd,category,totalNetAssets,investorType,minimumInitialInvestment,wam,wal,reportDate,yield,yieldDate,usTreasuryDebt,usGovernmentAgencyDebt,usGovernmentAgencyCouponDebt,usGovernmentAgencyZeroCouponDebt,nonUSSovereignDebt,certificateofDeposit,nonNegotiableTimeDeposit,variableRateDemandNote,otherMunicipalSecurity,assetBackedCommercialPaper,otherAssetBackedSecurities,usTreasuryRepurchaseAgreement,usGovernmentAgencyRepurchaseAgreement,otherRepurchaseAgreement,insuranceCompanyFundingAgreement,financialCompanyCommercialPaper,nonFinancialCompanyCommercialPaper,tenderOptionBond,otherInstrument,USGO,Muni
"VUSXX","Vanguard Treasury MM Investor","Vanguard Admiral Funds","Vanguard Treasury Money Market Fund","Investor Shares",0.0007,"0831","Government",98983157122.39,"Institutional",3000,43,48,"2025-10-31",0.0398,"2025-10-31",1,0,0,0,0,0,0,0,0,0,0,0,0,0,0,0,0,0,0,1,0
"VYFXX","Vanguard New York Municipal MM Investor","Vanguard New York Tax-free Funds","Vanguard New York Municipal Money Market Fund","Investor Shares",0.0011,"1130","SingleState",3270003756.46,"Retail",3000,13,15,"2025-10-31",0.0301,"2025-10-31",0,0,0,0,0,0,0,0.5346,0.03727,0,0,0,0,0,0,0,0.04156,0.38658,0,0,1
"WMPXX","Allspring MM Class Premier","Allspring Funds Trust","Allspring Money Market Fund","Premier Class",0.002,,"Prime",40864261157.03,"Retail",10000000,35,66,"2025-11-30",0.04,"2025-11-28",0,0,0,0,0.00589,0.22863,0.00264,0.07752,0.00121,0.36186,0,0.00603,0.24127,0,0,0.02982,0.00779,0.03721,0.00014,0,0.11594
"WOTXX","Allspring 100% Treasury MM Class Inst","Allspring Funds Trust","Allspring 100% Treasury Money Market Fund","Institutional Class",0.002,,"Government",11906359722.68,"Institutional",10000000,53,92,"2025-11-30",0.0378,"2025-11-28",1,0,0,0,0,0,0,0,0,0,0,0,0,0,0,0,0,0,0,1,0
"WSTXX","Blackrock Liquidity Fedfund Westcap Shares","Blackrock Liquidity Funds","Fedfund","Westcap Shares",0.0017,"1031","Government",48621018.22,"Institutional",3000000,39,103,"2025-11-30",0.0386,"2025-11-28",0.43584,0,0.14674,0.00351,0,0,0,0,0,0,0,0.27784,0.13607,0,0,0,0,0,0,0.58609,0
"XTSLA","Blackrock Cash Funds Treasury Sl Agency Shares","Blackrock Funds Iii","Blackrock Cash Funds: Treasury","Sl Agency Shares",0.0009,"1231","Government",18036433667.32,"Institutional",100000000,1,1,"2025-10-31",0.0405,"2025-10-31",,,,,,,,,,,,,,,,,,,,,
