ticker,friendlyName,registrantName,seriesName,className,expenseRatio,fiscalYearEnd,category,totalNetAssets,investorType,minimumInitialInvestment,wam,wal,reportDate,yield,yieldDate,usTreasuryDebt,usGovernmentAgencyDebt,usGovernmentAgencyCouponDebt,usGovernmentAgencyZeroCouponDebt,nonUSSovereignDebt,certificateofDeposit,nonNegotiableTimeDeposit,variableRateDemandNote,otherMunicipalSecurity,assetBackedCommercialPaper,otherAssetBackedSecurities,usTreasuryRepurchaseAgreement,usGovernmentAgencyRepurchaseAgreement,otherRepurchaseAgreement,insuranceCompanyFundingAgreement,financialCompanyCommercialPaper,nonFinancialCompanyCommercialPaper,tenderOptionBond,otherInstrument,USGO,Muni
"VMSXX","Vanguard Municipal MM Investor","Vanguard Municipal Bond Funds","Vanguard Municipal Money Market Fund","Investor Shares","","1031","Muni",17721968973.31,"Retail",3000,14,16,"2025-07-31",0.027,"2025-07-31",0,0,0,0,0,0,0,0.53711,0.03378,0,0,0,0,0,0,0,0.05248,0.37663,0,0,1
"VUSXX","Vanguard Treasury MM Investor","Vanguard Admiral Funds","Vanguard Treasury Money Market Fund","Investor Shares","","0831","Government",95053325502.43,"Institutional",3000,40,46,"2025-07-31",0.0423,"2025-07-31",0.93644,0,0,0,0,0,0,0,0,0,0,0.06356,0,0,0,0,0,0,0,0.93644,0
"VYFXX","Vanguard New York Municipal MM Investor","Vanguard New York Tax-free Funds","Vanguard New York Municipal Money Market Fund","Investor Shares","","1130","SingleState",3299330224.66,"Retail",3000,13,14,"2025-07-31",0.0266,"2025-07-31",0,0,0,0,0,0,0,0.55477,0.0393,0,0,0,0,0,0,0,0.04888,0.35704,0,0,1
"WMPXX","Allspring MM Premier Class","Allspring Funds Trust","Allspring Money Market Fund","Premier Class","",,"Prime",38846048836.53,"Retail",10000000,34,70,"2025-07-31",0.0434,"2025-07-31",0,0,0,0,0.00358,0.21565,0.03321,0.07306,0.00208,0.3498,0,0,0.15704,0.07412,0,0.03472,0.01832,0.03841,0,0,0.11355
"WOTXX","Allspring 100% Treasury MM Institutional Shares","Allspring Funds Trust","Allspring 100% Treasury Money Market Fund","Institutional Class","",,"Government",10877664436.06,"Institutional",10000000,54,106,"2025-07-31",0.0414,"2025-07-31",1,0,0,0,0,0,0,0,0,0,0,0,0,0,0,0,0,0,0,1,0
"WSTXX","Blackrock Liquidity Fedfund Westcap Shares","Blackrock Liquidity Funds","Fedfund","Westcap Shares",0.0017,"1031","Government",53208484.93,"Institutional",3000000,49,106,"2025-08-31",0.0419,"2025-08-29",0.44113,0,0.13929,0.00538,0,0,0,0,0,0,0,0.27468,0.13952,0,0,0,0,0,0,0.5858,0
"XTSLA","Blackrock Cash Funds Treasury Sl Agency Shares","Blackrock Funds Iii","Blackrock Cash Funds: Treasury","Sl Agency Shares",0.0009,"1231","Government",15749006567.4,"Institutional",100000000,1,1,"2025-07-31",0.043,"2025-07-31",,,,,,,,,,,,,,,,,,,,,
