asOfDate,ticker,oneDayYield,sevenDayYield,thirtyDayYield,nav,aum,twelveMonTrlYield,yieldToWorst,yieldToMaturity,distributionYield,weightedAverageCoupon,durationYears,maturityYears,expenseRatio,accountType,source
"2026-07-10","VBIL",,,,75.56,9400000000,,,,,,0.1,0.1,,"Vanguard 0-3 Month Treasury Bill ETF","advisors.vanguard.com"
"2026-07-10","VTC",,,,75.91,1800000000,,,,,,6.6,6.6,,"Vanguard Total Corporate Bond ETF","advisors.vanguard.com"
"2026-07-10","VTEC",,,,99.9,2800000000,,,,,,6.6,6.6,,"Vanguard California Tax-Exempt Bond ETF","advisors.vanguard.com"
"2026-07-10","VTEI",,,,100.42,1500000000,,,,,,5.4,5.4,,"Vanguard Intermediate-Term Tax-Exempt Bond ETF","advisors.vanguard.com"
"2026-07-10","VTEL",,,,103.83,287800000,,,,,,9.2,9.2,,"Vanguard Long-Term Tax-Exempt Bond ETF","advisors.vanguard.com"
