asOfDate,ticker,oneDayYield,sevenDayYield,thirtyDayYield,nav,aum,twelveMonTrlYield,yieldToWorst,yieldToMaturity,distributionYield,weightedAverageCoupon,durationYears,maturityYears,expenseRatio,accountType,source
"2026-07-13","BNDP",,,,73.35,128000000,,,,,,5.5,5.5,,"Vanguard Core-Plus Bond Index ETF","advisors.vanguard.com"
"2026-07-13","VCIT",,,,81.51,67300000000,,,,,,6,6,,"Vanguard Intermediate-Term Corporate Bond ETF","advisors.vanguard.com"
"2026-07-13","VPLS",,,,76.54,1700000000,,,,,,5.6,5.6,,"Vanguard Core-Plus Bond ETF","advisors.vanguard.com"
"2026-07-13","VTP",,,,75.21,159000000,,,,,,86.3,86.3,,"Vanguard Total Inflation-Protected Securities ETF","advisors.vanguard.com"
"2026-07-13","BIV",,,,75.72,29300000000,,,,,,6,6,,"Vanguard Intermediate-Term Bond ETF","advisors.vanguard.com"
