asOfDate,ticker,oneDayYield,sevenDayYield,thirtyDayYield,nav,aum,twelveMonTrlYield,yieldToWorst,yieldToMaturity,distributionYield,weightedAverageCoupon,durationYears,maturityYears,expenseRatio,accountType,source
"2026-07-07","VGLT",,,0.05,53.95,10500000000,,,,,,13.6,13.6,0.0003,"Vanguard Long-Term Treasury ETF","advisors.vanguard.com"
"2026-07-07","VCLT",,,0.0587,73.68,9200000000,,,,,,12,12,0.0003,"Vanguard Long-Term Corporate Bond ETF","advisors.vanguard.com"
"2026-07-07","VGSH",,,0.0416,58.01,29400000000,,,,,,1.9,1.9,0.0003,"Vanguard Short-Term Treasury ETF","advisors.vanguard.com"
"2026-07-07","VTES",,,0.0264,101.02,2100000000,,,,,,2.6,2.6,0.0005,"Vanguard Short-Term Tax-Exempt Bond ETF","advisors.vanguard.com"
"2026-07-07","BND",,,0.0454,72.71,159800000000,,,,,,5.7,5.7,0.0003,"Vanguard Total Bond Market ETF","advisors.vanguard.com"
