asOfDate,ticker,oneDayYield,sevenDayYield,thirtyDayYield,nav,aum,twelveMonTrlYield,yieldToWorst,yieldToMaturity,distributionYield,weightedAverageCoupon,durationYears,maturityYears,expenseRatio,accountType,source
"2026-07-08","VSDB",,,0.0476,75.91,895700000,,,,,,2.6,2.6,0.0015,"Vanguard Short Duration Bond ETF","advisors.vanguard.com"
"2026-07-08","VSDM",,,0.0324,76.37,763100000,,,,,,2.9,2.9,0.0012,"Vanguard Short Duration Tax-Exempt Bond ETF","advisors.vanguard.com"
"2026-07-08","VGMS",,,0.0551,50.95,235000000,,,,,,3.7,3.7,0.003,"Vanguard Multi-Sector Income Bond ETF","advisors.vanguard.com"
"2026-07-08","VGUS",,,0.0369,75.5,1000000000,,,,,,0.3,0.3,0.0007,"Vanguard Ultra-Short Treasury ETF","advisors.vanguard.com"
"2026-07-08","VMBS",,,0.0424,46.42,15600000000,,,,,,5.2,5.2,0.0003,"Vanguard Mortgage-Backed Securities ETF","advisors.vanguard.com"
