asOfDate,ticker,oneDayYield,sevenDayYield,thirtyDayYield,nav,aum,twelveMonTrlYield,yieldToWorst,yieldToMaturity,distributionYield,weightedAverageCoupon,durationYears,maturityYears,expenseRatio,accountType,source
"2026-04-02","VTP",,,0.0143,76.28,110200000,,,0.0412,,0.0126,6.4,7.2,0.0005,"Total Inflation-Protected Securities ETF","advisors.vanguard.com"
"2026-04-07","VBIL",,,0.036,75.5,6700000000,,0.0365,0.0365,0.0339,,0.1,0.1,0.0006,"0-3 Month Treasury Bill ETF","advisors.vanguard.com"
"2026-04-07","VCIT",,,0.0509,82.97,64200000000,,0.0506,0.0509,0.0505,0.0492,6,7.5,0.0003,"Intermediate-Term Corporate Bond ETF","advisors.vanguard.com"
"2026-04-07","VCLT",,,0.0585,75.21,7400000000,,0.0581,0.0581,0.0579,0.0478,12.1,22.2,0.0003,"Long-Term Corporate Bond ETF","advisors.vanguard.com"
"2026-04-07","VSDB",,,0.0458,76.18,458600000,,0.0491,0.0495,0.0445,0.0451,2.6,3.4,0.0015,"Short Duration Bond ETF","advisors.vanguard.com"
"2026-04-07","VSDM",,,0.032,76.46,538600000,,0.0346,,0.0315,0.0424,2.9,5.1,0.0012,"Short Duration Tax-Exempt Bond ETF","advisors.vanguard.com"
