asOfDate,ticker,oneDayYield,sevenDayYield,thirtyDayYield,nav,aum,twelveMonTrlYield,yieldToWorst,yieldToMaturity,distributionYield,weightedAverageCoupon,durationYears,maturityYears,expenseRatio,accountType,source
"2026-07-10","VGMS",,,,50.92,235000000,,,,,,3.7,3.7,,"Vanguard Multi-Sector Income Bond ETF","advisors.vanguard.com"
"2026-07-10","VGUS",,,,75.51,1000000000,,,,,,0.3,0.3,,"Vanguard Ultra-Short Treasury ETF","advisors.vanguard.com"
"2026-07-10","VMBS",,,,46.37,15600000000,,,,,,5.2,5.2,,"Vanguard Mortgage-Backed Securities ETF","advisors.vanguard.com"
"2026-07-10","VSDB",,,,75.87,895700000,,,,,,2.6,2.6,,"Vanguard Short Duration Bond ETF","advisors.vanguard.com"
"2026-07-10","VSDM",,,,76.37,763100000,,,,,,2.9,2.9,,"Vanguard Short Duration Tax-Exempt Bond ETF","advisors.vanguard.com"
