asOfDate,ticker,oneDayYield,sevenDayYield,thirtyDayYield,nav,aum,twelveMonTrlYield,yieldToWorst,yieldToMaturity,distributionYield,weightedAverageCoupon,durationYears,maturityYears,expenseRatio,accountType,source
"2026-07-17","BNDX",,,,47.84,83000000000,,,,,,6.6,6.6,,"Vanguard Total International Bond ETF","advisors.vanguard.com"
"2026-07-17","VBIL",,,,75.61,9400000000,,,,,,0.1,0.1,,"Vanguard 0-3 Month Treasury Bill ETF","advisors.vanguard.com"
"2026-07-17","VCIT",,,,81.9,67300000000,,,,,,6,6,,"Vanguard Intermediate-Term Corporate Bond ETF","advisors.vanguard.com"
"2026-07-17","VGMS",,,,50.93,235000000,,,,,,3.6,3.6,,"Vanguard Multi-Sector Income Bond ETF","advisors.vanguard.com"
"2026-07-17","VGSH",,,,58.1,29400000000,,,,,,1.8,1.8,,"Vanguard Short-Term Treasury ETF","advisors.vanguard.com"
