asOfDate,ticker,oneDayYield,sevenDayYield,thirtyDayYield,nav,aum,twelveMonTrlYield,yieldToWorst,yieldToMaturity,distributionYield,weightedAverageCoupon,durationYears,maturityYears,expenseRatio,accountType,source
"2026-04-30","BNDW",,,0.0422,67.46,1600000000,,0.0493,0.0495,0.0345,0.0321,6.1,8.1,0.0005,"Total World Bond ETF","advisors.vanguard.com"
"2026-05-14","VTP",,,0.0142,76.19,122800000,,,0.0441,,0.013,6.4,7.2,0.0005,"Total Inflation-Protected Securities ETF","advisors.vanguard.com"
"2026-05-18","BNDP",,,0.0473,73.27,117100000,,0.05,0.0502,,0.0407,5.5,7.8,0.0005,"Core-Plus Bond Index ETF","advisors.vanguard.com"
"2026-05-18","VCIT",,,0.0513,81.57,66000000000,,0.0525,0.0528,0.0478,0.0497,6,7.6,0.0003,"Intermediate-Term Corporate Bond ETF","advisors.vanguard.com"
"2026-05-18","VCLT",,,0.0594,73.09,7700000000,,0.0594,0.0595,0.053,0.048,12,22.2,0.0003,"Long-Term Corporate Bond ETF","advisors.vanguard.com"
"2026-05-18","VCRM",,,0.0393,74.93,1300000000,,0.0436,,0.0383,0.0482,7.1,16.8,0.0012,"Core Tax-Exempt Bond ETF","advisors.vanguard.com"
