asOfDate,ticker,oneDayYield,sevenDayYield,thirtyDayYield,nav,aum,twelveMonTrlYield,yieldToWorst,yieldToMaturity,distributionYield,weightedAverageCoupon,durationYears,maturityYears,expenseRatio,accountType,source
"2026-07-16","VCRB",,,,76.46,7300000000,,,,,,5.7,5.7,,"Vanguard Core Bond ETF","advisors.vanguard.com"
"2026-07-16","VCEB",,,,62.04,1200000000,,,,,,6.2,6.2,,"Vanguard ESG U.S. Corporate Bond ETF","advisors.vanguard.com"
"2026-07-16","VTEC",,,,99.57,2800000000,,,,,,6.6,6.6,,"Vanguard California Tax-Exempt Bond ETF","advisors.vanguard.com"
"2026-07-16","BLV",,,,67.37,6000000000,,,,,,12.8,12.8,,"Vanguard Long-Term Bond ETF","advisors.vanguard.com"
"2026-07-16","VCLT",,,,73.42,9200000000,,,,,,11.9,11.9,,"Vanguard Long-Term Corporate Bond ETF","advisors.vanguard.com"
