asOfDate,ticker,oneDayYield,sevenDayYield,thirtyDayYield,nav,aum,twelveMonTrlYield,yieldToWorst,yieldToMaturity,distributionYield,weightedAverageCoupon,durationYears,maturityYears,expenseRatio,accountType,source
"2026-07-21","VUSB",,,,49.69,8900000000,,,,,,0.9,0.9,,"Vanguard Ultra-Short Bond ETF","advisors.vanguard.com"
"2026-07-21","BND",,,,72.51,159800000000,,,,,,5.7,5.7,,"Vanguard Total Bond Market ETF","advisors.vanguard.com"
"2026-07-21","MUNY",,,,102.52,446600000,,,,,,6.8,6.8,,"Vanguard New York Tax-Exempt Bond ETF","advisors.vanguard.com"
"2026-07-21","VPLS",,,,76.52,1700000000,,,,,,5.5,5.5,,"Vanguard Core-Plus Bond ETF","advisors.vanguard.com"
"2026-07-21","VTEL",,,,103.19,287800000,,,,,,9.2,9.2,,"Vanguard Long-Term Tax-Exempt Bond ETF","advisors.vanguard.com"
