asOfDate,ticker,oneDayYield,sevenDayYield,thirtyDayYield,nav,aum,twelveMonTrlYield,yieldToWorst,yieldToMaturity,distributionYield,weightedAverageCoupon,durationYears,maturityYears,expenseRatio,accountType,source
"2026-07-14","BIV",,,,75.9,29300000000,,,,,,6,6,,"Vanguard Intermediate-Term Bond ETF","advisors.vanguard.com"
"2026-07-14","BNDP",,,,73.49,128000000,,,,,,5.5,5.5,,"Vanguard Core-Plus Bond Index ETF","advisors.vanguard.com"
"2026-07-14","VCIT",,,,,67300000000,,,,,,6,6,,"Vanguard Intermediate-Term Corporate Bond ETF","advisors.vanguard.com"
"2026-07-14","VPLS",,,,76.67,1700000000,,,,,,5.6,5.6,,"Vanguard Core-Plus Bond ETF","advisors.vanguard.com"
"2026-07-14","VTP",,,,75.29,159000000,,,,,,86.2,86.2,,"Vanguard Total Inflation-Protected Securities ETF","advisors.vanguard.com"
