asOfDate,ticker,oneDayYield,sevenDayYield,thirtyDayYield,nav,aum,twelveMonTrlYield,yieldToWorst,yieldToMaturity,distributionYield,weightedAverageCoupon,durationYears,maturityYears,expenseRatio,accountType,source
"2026-07-10","VGIT",,,,58.54,42100000000,,,,,,4.9,4.9,,"Vanguard Intermediate-Term Treasury ETF","advisors.vanguard.com"
"2026-07-10","VGSH",,,,58.03,29400000000,,,,,,1.8,1.8,,"Vanguard Short-Term Treasury ETF","advisors.vanguard.com"
"2026-07-10","VWOB",,,,66.62,6300000000,,,,,,6.7,6.7,,"Vanguard Emerging Markets Government Bond ETF","advisors.vanguard.com"
"2026-07-10","BND",,,,72.74,159800000000,,,,,,5.7,5.7,,"Vanguard Total Bond Market ETF","advisors.vanguard.com"
"2026-07-10","BNDW",,,,67.95,1900000000,,,,,,,,,"Vanguard Total World Bond ETF","advisors.vanguard.com"
