asOfDate,ticker,oneDayYield,sevenDayYield,thirtyDayYield,nav,aum,twelveMonTrlYield,yieldToWorst,yieldToMaturity,distributionYield,weightedAverageCoupon,durationYears,maturityYears,expenseRatio,accountType,source
"2026-07-20","VGIT",,,,58.55,42100000000,,,,,,4.8,4.8,,"Vanguard Intermediate-Term Treasury ETF","advisors.vanguard.com"
"2026-07-20","VTES",,,,100.83,2100000000,,,,,,2.6,2.6,,"Vanguard Short-Term Tax-Exempt Bond ETF","advisors.vanguard.com"
"2026-07-20","BNDX",,,,47.78,83000000000,,,,,,6.6,6.6,,"Vanguard Total International Bond ETF","advisors.vanguard.com"
"2026-07-20","VBIL",,,,75.62,9400000000,,,,,,0.1,0.1,,"Vanguard 0-3 Month Treasury Bill ETF","advisors.vanguard.com"
"2026-07-20","VTC",,,,75.77,1800000000,,,,,,6.5,6.5,,"Vanguard Total Corporate Bond ETF","advisors.vanguard.com"
