asOfDate,ticker,oneDayYield,sevenDayYield,thirtyDayYield,nav,aum,twelveMonTrlYield,yieldToWorst,yieldToMaturity,distributionYield,weightedAverageCoupon,durationYears,maturityYears,expenseRatio,accountType,source
"2026-07-17","VCSH",,,,78.71,44900000000,,,,,,2.7,2.7,,"Vanguard Short-Term Corporate Bond ETF","advisors.vanguard.com"
"2026-07-17","VTC",,,,75.96,1800000000,,,,,,6.5,6.5,,"Vanguard Total Corporate Bond ETF","advisors.vanguard.com"
"2026-07-17","VTIP",,,,49.65,19300000000,,,,,,72.3,72.3,,"Vanguard Short-Term Inflation-Protected Securities ETF","advisors.vanguard.com"
"2026-07-17","BNDP",,,,73.63,128000000,,,,,,5.5,5.5,,"Vanguard Core-Plus Bond Index ETF","advisors.vanguard.com"
"2026-07-17","VGIT",,,,58.66,42100000000,,,,,,4.8,4.8,,"Vanguard Intermediate-Term Treasury ETF","advisors.vanguard.com"
